"Title","Subtitle","Downloads"
"Scientific American Supplement, No. 601, July 9, 1887","Various","57"
"The Popular Science Monthly, September, 1900","Various","57"
"Pneumatic conveying","Ernest George Phillips","57"
"The Train Wire: A Discussion of the Science of Train Dispatching","John Alexander Anderson","57"
"The American Electro Magnetic Telegraph","Alfred Vail","57"
"Lecture on Artificial Flight","William G. Krueger","57"
"Scientific American Supplement, No. 470, January 3, 1885","Various","57"
"Keeping Down the Cost of Your Woodwork","Curtis Companies","57"
"Hoisting Appliances","International Correspondence Schools","57"
"Careers in Atomic Energy","Loyce J. McIlhenny","57"
"American Horological Journal, Vol. I, No. 1, July 1869: Devoted to Pratical Horology","N/A","57"
"A Short List of Scientific Books Published by E. & F. N. Spon, Limited. June 1913","E. & F. N. Spon","57"
"Benjamin Franklin and the First Balloons","Benjamin Franklin","57"
"Scientific American Supplement, No. 611, September 17, 1887","Various","56"
"The Popular Science Monthly, August, 1900","Various","56"
"Gas Burners Old and New","Owen Merriman","56"
"Le Livre 010101, Tome 1 (1993-1998) (French)","Marie Lebert","56"
"De l'imprimé à Internet (French)","Marie Lebert","56"
"Scientific American Supplement, No. 810, July 11, 1891","Various","56"
"Scientific American Supplement, No. 275, April 9, 1881","Various","56"
"Appletons' Popular Science Monthly, August 1899","Various","56"
"Scientific American Supplement, No. 648, June 2, 1888.","Various","56"
"How Paper Boxes Are Made","Robert F. Salade","55"
"The Science of Brickmaking","George Frederick Harris","55"
"Scientific American Supplement, No. 1178, June 25, 1898","Various","55"
"Scientific American Supplement, No. 595, May 28, 1887","Various","55"
"Glass Manufacture","Walter Rosenhain","55"
"Nouveau moyen de préparer la couche sensible des plaques destinées à recevoir les images photographiques (French)","Louis Jacques Mandé Daguerre","55"
"Scientific American Supplement, No. 421,  January 26, 1884","Various","55"
"The Gasoline Motor","Harold Whiting Slauson","55"
"Scientific American Supplement, No. 312, December 24, 1881","Various","54"
"A Description of a New-Invented Stove-Grate","J. Durno","54"
"The Popular Science Monthly, June, 1900","Various","54"
"Bromoil printing and bromoil transfer","Emil Mayer","54"
"Transactions of the American Society of Civil Engineers, vol. LXVIII, Sept. 1910, Start/End Papers","Various","54"
"Vacuum cleaning systems :  A treatise on the principles and practice of mechanical cleaning","M. S. Cooley","53"
"Bangerter's Inventions; His Marvelous Time Clock","N/A","53"
"Bamboo, Considered as a Paper-making Material","Thomas Routledge","53"
"Scientific American, September 29, 1883 Supplement. No. 404","Various","53"
"Scientific American Supplement, No. 530, February 27, 1886","Various","53"
"A Practical Manual of the Collodion Process, Giving in Detail a Method For Producing Positive and Negative Pictures on Glass and Paper.","S. D. Humphrey","52"
"Scaffolding :  a treatise on the design & erection of scaffolds, gantries, and stagings, with an account of the appliances used in connection therewith for the use of contractors, builders, clerks of works, etc., with a chapter on the legal aspect of the question","A. G. H. Thatcher","52"
"Linotype mechanism","Alvin Garfield Swank and Raymond Means","52"
"The Fifteen Watt Tungsten Lamp","Clair Elmore Anderson","51"
"Great Western Railway Instructions","William Wylie Grierson","51"
"The Manufacture of Tomato Products","W. G. Hier","51"
"Transient","William Harris","51"
"Le multilinguisme sur le Web (French)","Marie Lebert","51"
"Transactions of the American Society of Civil Engineers, vol. LXX, Dec. 1910","Eugene Klapp","51"
"The Economy of Workshop Manipulation","John Richards","51"
"Appletons' Popular Science Monthly, September 1899","Various","51"
"Design of a Steel Railroad Warehouse","Louis Liston Tallyn","51"
"The Engineering Contributions of Wendel Bollman","Robert M. Vogel","51"
"The Aviator and the Weather Bureau","Ford A. Carpenter","51"
"Cotton Manufacturing","Christopher Parkinson Brooks","50"
"Water Power for the Farm and Country Home","David R. Cooper","50"
"The Library of Work and Play: Electricity and Its Everyday Uses","John F. Woodhull","50"
"Scientific American Supplement, No. 324, March 18, 1882","Various","50"
"The Problem of Manflight","James Means","50"
"Ditching Procedure, B-29s with Four-Gun Turret","United States. Army Air Forces","49"
"Descriptive Pamphlet of the Richmond Mill Furnishing Works","Richmond Mill Furnishing Works","49"
"Delco Radio Owner's Manual Model 633; Delcotron Generator Installation","Delco-Remy Corporation","49"
"Address by Honorable Franklin K. Lane, Secretary of the Interior at Conference of Regional Chairmen of the Highways Transport Committee Council of National Defense","United States. Council of National Defense. Highways Transport Committee","49"
"The Century of Inventions of the Marquis of Worcester","Marquis of Edward Somerset Worcester","49"
"Scientific American Supplement, No. 492, June 6, 1885","Various","49"
"Scientific American Supplement, No. 620,  November 19,1887","Various","48"
"The telephone :  a lecture entitled Researches in electric telephony","Alexander Graham Bell","48"
"Scientific American Supplement, No. 430, March 29, 1884","Various","48"
"The Art of Lead Burning","C. H. Fay","48"
"Appletons' Popular Science Monthly, May, 1900","Various","48"
"The Thompson-Houston System of Electric Lighting","H. T. Cory","48"
"Lace Curtain Cleaning: A Successful Home Business","Sarah Ann Leigh","47"
"""Undo"": A Novel","Joe Hutsko","47"
"Booknología: El libro digital (1971-2010) (Spanish)","Marie Lebert","47"
"Return-Loads Bureaus to Save Waste in Transportation","United States. Council of National Defense. Highways Transport Committee","46"
"Appletons' Popular Science Monthly, May 1899","Various","46"
"Appletons' Popular Science Monthly, November 1899","Various","46"
"Report of the Hoosac Tunnel and Troy and Greenfield Railroad, by the Joint Standing Committee of 1866.","Tappan Wentworth","46"
"Scientific American Supplement, No. 803, May 23, 1891","Various","45"
"Scientific American Supplement, No. 303, October 22, 1881","Various","45"
"Le Circuit de l'Est [programme] (French)","Commune de Amiens/Nancy","44"
"Entrevistas (1998-2001) (Spanish)","Marie Lebert","44"
"Scientific American Supplement, No. 613, October 1, 1887","Various","43"
"Report of the Several Works Connected with the Draining, Paving & Lighting the Parish of Saint Mary Abbotts, Kensington, 1856","James Broadbridge","43"
"Something about sugar :  Its history, growth, manufacture and distribution","George M. Rolph","43"
"Scientific American Supplement, No. 441, June 14, 1884.","Various","42"
"Big Ben Clock Tower of Westminster","N/A","42"
"The Drama of Glass","Kate Field","42"
"Pulp and Paper Magazine, Vol. XIII, No. 20, October 15, 1916","Various","41"
"Airplane Boys at Platinum River","E. J. Craine","41"
"Natural Stability and the Parachute Principle in Aeroplanes","W. LeMaitre","40"
"Automobiel-rijden (Dutch)","Tom Schilperoort","39"
"Report on the Plans of the Various Railways before the Examiners of the House of Commons, 1864, so far as relates to the Parish of Kensington","James Broadbridge","39"
"Lightning Rod Conference","N/A","39"
"Scientific American Supplement, No. 385, May 19, 1883","Various","39"
"Things to Know About Trade-Marks: A Manual of Trade-Mark Information","J. Walter Thompson Company","38"
"Wireless Transmission of Photographs","Marcus J. Martin","37"
"The Journal of Electricity, Power and Gas, Volume XX, No. 18, May 2, 1908","Various","35"
"Electricity and Progress","Thomas A. Edison","34"
"Transactions of the American Society of Civil Engineers, vol. LXX, Dec. 1910","John Howell Griffith","33"
"Specifications for street roadway pavements","Samuel Whinery","32"
"Central-Station Electric Lighting","Killingworth Hedges","32"
"El Presidente Díaz al Señor Edison (Spanish)","Porfirio Díaz","30"
"Plaque No. 1","Losey's Orchestra","30"
"The Dry Collodion Process","Charles A. Long","29"
"The Art of Graining: How Acquired and How Produced.","Charles Pickert and A. Metcalf","29"
"On the relation which ought to subsist between the strength of an electric current and the diameter of conductors, to prevent overheating","George Forbes","27"
"Discussion on Edison's Monoid Theory","Theodore M. Edison","27"
"The Birth of the Telephone","Thomas Augustus Watson","21"
"Plaque No. 2","Losey's Orchestra","20"
"Plaque No. 6","Losey's Orchestra","20"
"Transcontinental Telephone Address to Thomas A. Edison","Miller Reese Hutchinson","19"
"To Edison from Colonel Gouraud, Introducing Mr. Gladstone","N/A","15"
"Remarks from a Visit to Edison Laboratory","Josephus Daniels","12"
"Words of Welcome","Garret A. Hobart","11"
"Remarks from a Visit to Edison Laboratory","Nelson Appleton Miles","11"
